{"$schema":"https://json-schema.org/draft/2020-12/schema","title":"Oracle Lab Governance Amendment Review","type":"object","additionalProperties":false,"required":["schema_version","review_kind","reviewer_identity","reviewer_role","reviewed_candidate_heads","diff_digests","plan_digest","review_import_digest","decision","findings","verification"],"properties":{"schema_version":{"const":1},"review_kind":{"const":"governance_amendment_review"},"reviewer_identity":{"type":"string","pattern":"^[A-Za-z0-9._@-]{3,128}$"},"reviewer_role":{"enum":["requirements","security_quality"]},"reviewed_candidate_heads":{"$ref":"#/$defs/heads"},"diff_digests":{"$ref":"#/$defs/diffs"},"plan_digest":{"$ref":"#/$defs/digest"},"review_import_digest":{"$ref":"#/$defs/digest"},"decision":{"const":"approved"},"findings":{"type":"object","additionalProperties":false,"required":["critical","important","summaries"],"properties":{"critical":{"const":0},"important":{"const":0},"summaries":{"type":"array","maxItems":32,"items":{"type":"string","minLength":1,"maxLength":512}}}},"verification":{"type":"array","minItems":1,"maxItems":64,"items":{"type":"string","minLength":1,"maxLength":512}}},"$defs":{"digest":{"type":"string","pattern":"^sha256:[0-9a-f]{64}$"},"commit":{"type":"string","pattern":"^[0-9a-f]{40,64}$"},"heads":{"type":"object","additionalProperties":false,"required":["cc_gateway","sub2api"],"properties":{"cc_gateway":{"$ref":"#/$defs/commit"},"sub2api":{"$ref":"#/$defs/commit"}}},"diffs":{"type":"object","additionalProperties":false,"required":["cc_gateway","sub2api"],"properties":{"cc_gateway":{"$ref":"#/$defs/digest"},"sub2api":{"$ref":"#/$defs/digest"}}}}}
