{
  "schema_version": 1,
  "review_kind": "governance_amendment_review",
  "reviewer_identity": "codex-requirements-reviewer-868a446",
  "reviewer_role": "requirements",
  "reviewed_candidate_heads": {
    "cc_gateway": "868a446c799bae2df65320f9c57bca67e9e8cd0d",
    "sub2api": "0a97b3f3b84b5c679788b3694d5840e235031f07"
  },
  "diff_digests": {
    "cc_gateway": "sha256:5920023e60a582dd13c0116fd03d87d64ae195c125af8695c87427fe39c38ab5",
    "sub2api": "sha256:e52795208eb1d30a91430f9dd84581e93b929091b833f71856243a8fb8f88ff4"
  },
  "plan_digest": "sha256:b31e3f534cd3ef2c27c4bbce1dbb1422d431d76b59ea252466d2bfc2ae7c3049",
  "review_import_digest": "sha256:c8849e572728ba66ce9cb73b73185130eab47160df48c7ac01b25cd75467e020",
  "decision": "approved",
  "findings": {
    "critical": 0,
    "important": 0,
    "summaries": [
      "Whole-branch requirements re-review approved with no Critical, Important, or Minor findings.",
      "All 15 exit-contract conditions remain represented without premature completion claims."
    ]
  },
  "verification": [
    "reviewer=codex-requirements-reviewer-868a446 role=requirements decision=approved critical=0 important=0 minor=0",
    "heads=cc:868a446c799bae2df65320f9c57bca67e9e8cd0d,sub:0a97b3f3b84b5c679788b3694d5840e235031f07 worktrees=clean",
    "diffs=cc:sha256:5920023e60a582dd13c0116fd03d87d64ae195c125af8695c87427fe39c38ab5,sub:sha256:e52795208eb1d30a91430f9dd84581e93b929091b833f71856243a8fb8f88ff4",
    "inputs=plan:sha256:b31e3f534cd3ef2c27c4bbce1dbb1422d431d76b59ea252466d2bfc2ae7c3049,review-import:sha256:c8849e572728ba66ce9cb73b73185130eab47160df48c7ac01b25cd75467e020",
    "governance=41_v2_homogeneous;v1_preserved=23;ra=18_deferred;task2_task3_adoption=complete;runtime_authority=false",
    "coverage=observations:10;wp_mappings:10;dag:7_top_level;precedence:review>hardening>adversarial>design;exit_conditions:15",
    "history=phase0_postintegration_postintegrationv2_unchanged;candidate_topology=bound;premature_formal_artifacts=absent",
    "verification=read_only_static_and_object_checks;supplied_test_results_reviewed;tests_not_rerun_by_requirements_reviewer"
  ]
}
